{
  "$schema": "https://schemas.prismatic.dev/pwp/theme.schema.json",
  "id": "pwp.theme.trust-light",
  "name": "Trust Light",
  "version": "0.1.0",
  "engineCompatibility": ">=0.2.0",
  "framework": "astro",
  "editableWith": [
    "emdash"
  ],
  "entrypoints": {
    "tokens": "tokens/tokens.json",
    "css": "src/styles/theme.css",
    "layout": "src/layouts/BaseLayout.astro",
    "components": "src/components/index.ts",
    "contentSchema": "src/content.config.ts",
    "emdashMap": "emdash/fields.json"
  },
  "modules": [
    "hero",
    "lead-capture"
  ],
  "verification": {
    "commands": [
      "python3 scripts/pwp theme validate tests/fixtures/pwp_theme/valid_theme"
    ]
  }
}
